Name,Description,Subreddits,Equipment,Tags
2nd Common Language (Mandarin Chinese),"The second most spoken language in the world and the most natively spoken language in the world. The primary language of China, Macau, Hong Kong, Singapore and Taiwan (though as many speak Hokkien Taiwanese)",r/ChineseLanguage/,,
3rd Common Language (Hindi),The third most spoken language in the world and fourth most natively spoken. The primary language of India and Fiji.,r/Hindi/,,
3D Printing,A type of additive construction which prints 3D Objects from digital CAD or 3D Models,r/3Dprinting/,,"Solo, Sedentary"
4th Common Language (Spanish),"The second most natively spoken and fourth most spoken language overall. The primary language in Spain, Argentina, Bolivia, Chile, Colombia, Costa Rica, Cuba, Ecuador (Castilian), El Salvador, Equatorial Guinea (the only African country which speaks mostly Spanish though there are many Fang and Portugese speakers), Guatemala, Honduras (Honduran), Mexico, Nicaragua, Panama, Peru,  Uruguay, Venezuela.",r/learnspanish/,,
5th Common Language (French),"The fifth most spoken language worldwide, though most speakers are non native. Primary language of Benin (though they have a lot of Fon and Yoruba group languages), Burkina Faso, Cameroon, The Democratic Republic of Congo, Côte d’Ivoire/Ivory Coast (though Baule is highly spoken as well and the country has many languages), Gabon (though Fang is spoken heavily there as well), Monaco, Togo (though many speak Ewe as well). Useful in West, Central and South Africa.",r/learnfrench/,,
6th Common Language (Arabic),"The sixth most spoken language in the world. The primary language of Algeria, Bahrain, Chad, Egypt, Iraq, Jordan, Kuwait (though almost half speak English as well), Lebanon (many also speak French), Libya, Mauritania (a good number speak French too), Morocco (though most speak French as well), Oman, Qatar (though many speak English), Saudi Arabia, Sudan, Syria, Tunisia (though most also speak French), the United Arab Emirates, Western Sahara and Yemen. Spoken widely in the Middle East and Northern Africa.",r/learn_arabic/,,
7th Common Language (Bengali/Bangla),"The seventh most spoken language in the world. The primary language of Bangaladesh. Spoken in Bangaladesh, as part of the 21 regional Indian languages and Sierra Leone.",r/learn_bengali/,,
8th Common Language (Russian),"The eighth most spoken language in the world. The primary language of Russia, Belarus, the detached Kalniningrad Oblast Region and Kazakhstan. Widespread in Eastern Europe.",r/russian/,,
9th Common Language (Portugese),"The ninth most spoken language in the world. The primary language of Portugal, Angola, Brazil, Mozambique (though a good number also speak Makhuwa), Sao Tome & Principe (though many speak Forro). Useful in Central Africa.",r/Portuguese/,,
Acting (General),"Portraying a character in a dramatic work of fiction, such as a play or film",r/acting,None,"Drama, Voice"
Acting (Miming/Pantomime),"Portraying a character without speaking, which originated in Greece",,None,Drama
Acting (Voice),"Portraying a character using only your voice, typically for animated films, podcasts or audiobooks",r/VoiceActing,None,"Drama, Voice"
Adventure Racing,,r/AdventureRacing/,,"Solo, Group, Active, Outdoor"
Africa Central: Language (Fang),A language spoken heavily in Equatorial Guinea and Gabon by the Fang people as part of the Bantu language group,,,
Africa Central:Language (Forro),A language heavily spoken in Sao Tome & Principe,,,
Africa Central:National Language (Sangho),Primary language of the Central African Republic (though there is a lot of French there too). Spoken in Sao Paolo in Brazil and the Central African Republic,,,
Africa Easterm:National Language (Oromo),The primary language of Ethiopia (though Amharic is spoken almost as much and is more associated generally with the country). Spoken by the Oromo people,,,
Africa Eastern:Language (Afar),One of the languages spoken in Djibouti by the Afar ethnic group,r/Afar/,,
Africa Eastern:Language (Amharic),Spoken in Ethiopia,r/amharic/,,
Africa Eastern:Language (Nyanja),A very common language in Zambia,,,
Africa Eastern:National Language (Bemba),The primary language of Zambia (though Nyanja is almost as possible),,,
Africa Eastern:National Language (Chewa/Chichewa),"Primary language of Malawi (though a good number speak English as well). Spoken in Malawi, Zimbabew, Mozambique and Zambia as one of the Bantu languages",,,
Africa Eastern:National Language (Comorian/Shikomoro),Primary language of the Comoros as one of the Bantu Languages,,,
Africa Eastern:National Language (Creole - Mauritius),The primary language of Mauritius (though most speak French and some speak English),,,
Africa Eastern:National Language (Creole - Seychelles),The primary language of the Seychelles (the most also speak English),,,
Africa Eastern:National Language (Kinyarwanda),"The primary language of Rwanda. Spoken in Rwanda, the Democratic Republic of Congo and Uganda",,,
Africa Eastern:National Language (Kirundi),"The primary language of Burundi. Spoken in Burundi, Tanzania, the Democratic Republic of Congo and Uganda",,,
Africa Eastern:National Language (Luganda),The primary language of Uganda (though many speak English),,,
Africa Eastern:National Language (Marshallese),Primary language spoken in the Marshall Islands and Mauritius,,,
Africa Eastern:National Language (Nuer/Dinka),The primary closesly related languages of South Sudan,,,
Africa Eastern:National Language (Somali),"Primary language of Djibouti (though Afar is spoken nearly as much), Somalia and Somaliland (though a good number in Somalia and Somaliland speak Arabic).",r/LearnSomali,,
Africa Eastern:National Language (Swahili),"The primary language of Kenya (though other Bantu languages like Kikuyu, Oluhyia and Kamba are very common as well as Nilotic group languages). Spoken in Kenya, Rwanda, Tanzania (though not spoken much as there isn't much of a primary language there) and Uganda",,,
Africa Eastern:National Language (Tigrinya),The primary language of Eritrea (though Tigre/Dahlik is heavily spoken there too). Spoken in Eritrea,,,
Africa Eastern:Native Language (Makhuwa/Makua),"The native language of the Makua people who make up the largest ethnic group in Mozambique, a Bantu language",,,
Africa Southern: National Language (Tswana/Setswana),The primary language of Botswana.,,,
Africa Southern:Language (Afrikaans),Spoken widely in South Africa and Namibia,r/LearnAfrikaans/,,
Africa Southern:National Language (Malagasy),Primary language of Madagascar (though a good number can speak French),,,
Africa Southern:National Language (Oshiwambo),The primary language of Namibia primarily spoken by the Ovambo ethnic group,,,
Africa Southern:National Language (Sotho/Sesotho/Southern Sotho),Primary language of Lesotho. Spoken in Lesotho and South Africa as part of the Bantu langague group,,,
Africa Southern:National Language (Swazi/siSwazi),Primary language of Eswatini (formerly called Swaziland). Spoken in Eswatini and South Africa by the Nguni people as part of the Bantu language group,,,
Africa Southern:National Language (Zulu),"The primary language of South Africa (though Xhosa, Afrikaans and English are understood in urban areas as there isn't much informity of language overall in the country)",,,
Africa Western: National Language (Mossi),The primary language of Burkina Faso as part of the Gur Languages (though French is the official language it isn't widely used).,,,
Africa Western:Language (Akan),Spoken heavily in Ghana by the Aja people,,,
Africa Western:Language (Baule/Bawule),A language spoken heavily in Ivory Coast,,,
Africa Western:Language (Ewe),Spoken heavily in Ghana and Togo,,,
Africa Western:Language (Fulfulde/Maasina),Heavily spoken in Mali by the Fula people of the Senegambian language group,,,
Africa Western:Language (Mende),A language spoken heavily in southern Sierra Leone,,,
Africa Western:Language (Soninke/Marka/Maraka),"Spoken heavily in Mali. Spoken in Mali, Mauritania and Senegal as part of the Mande languages",,,
Africa Western:Language (Yoruba),Spoken heavily in Nigeria and also in Benin by the Yoruba people,,,
Africa Western:National Language (Bambara/Bamanankan),Primary language of Mali (though a decent number speak French) by it's primary ethnic group the Bambara people as one of the Manding Languages,,,
Africa Western:National Language (Creole - Cape Verde),The primary language of Guinea-Bissau,,,
Africa Western:National Language (Creole - Sierra Leone/Krio),The primary language of Sierra Leone (though many speak Temne and Mende),,,
Africa Western:National Language (Fula/Pular),"Primary language of Guinea. Spoken heavily in The Gambia. Spoken in Benin, Burkina Faso, Guineau, Mali, Mauritania, Niger and Sengeal ",,,
Africa Western:National Language (Hausa),The primary language of Niger of the Hausa people. It is also heavily spoken in Nigeria.,,,
Africa Western:National Language (Mandinka/Mandingo),Primary language of The Gambia (though Fula and Wolof are heavily spoken there as well). Also spoken by Senegal and Guinea.,,,
Africa Western:National Language (Wolof),The primary language of Senegal (a good number also speak French). Also spoken in Mauritania.,,,
Africa Western:Native Language (Kpelle),Spoken by the largest native group in Liberia the Kpelle people and in Guinea as part of thr Mande family of languages,,,
Airsoft (Airsoft Guns),,r/airsoft/,,"Group, Active, Competitive"
Alcohol (Beer),A barley fermented drinkof low alcohol content commonly drank worldwide,r/beer/ ,,"Solo, Sedentary, Indoor"
Alcohol (Cocktails/Mixology),"Distilled spirits mixed with syrups, bitters and juices to create food products from alcohol",r/Mixology/,,"Solo, Sedentary, Indoor"
Alcohol (Drinking Games - Beer Pong),,r/beerpong/,,
Alcohol (Drinking Games - General),,r/DrinkingGames/,,
Alcohol (Gin),"A juniper and sage based distilled spirit associated with the united kingdom, it has a much higher alcohol content then beer or wine",r/Gin/,,"Solo, Sedentary, Indoor"
Alcohol (Homebrewing),Creating alcoholic drinks at home,r/Homebrewing,,"Solo, Sedentary, Indoor"
Alcohol (Mead),Wine made from honey,r/mead/,,"Solo, Sedentary, Indoor"
Alcohol (Rum),"A sugarcane based distilled spirit associated with the carribean, it has a much higher alcohol content then beer or wine",r/rum/,,"Solo, Sedentary, Indoor"
Alcohol (Tequila/Mezcal),"An agave based distilled spirit associated with mexico, it has a much higher alcohol content then beer or wine",r/tequila/,,"Solo, Sedentary, Indoor"
Alcohol (Whisky/ey - General),"A corn or barley based distilled spirit associated with america, ireland and scotland, it has a much higher alcohol content then beer or wine",r/whiskey/,,"Solo, Sedentary, Indoor"
Alcohol (Wine/Winemaking),A grapes based fermented drink of higher alcohol content then beer,r/wine/,,"Solo, Sedentary, Indoor"
Amateur Therapy (General),,,,"Solo, Sedentary"
Amateur Therapy (Relationships),,r/relationship_advice/,,"Solo, Sedentary"
Animal Training (Carrier/Homing Pigeon),,r/pigeon/,,"Solo, Active, Outdoor"
Animal Training (Dogs),,r/Dogtraining/,,"Solo, Active"
Animal Training (Falconry),,r/Falconry/,,"Solo, Active, Outdoor"
Animation (Stop Motion),"Creating films using a sequence of posed photographs to create the illusion of movement, such as in Wallace & Gromit or Robot Chicken",r/stop_motion,"Camera, Editing Software","Solo, Sedentary, Indoor"
Animation (Traditional),"Creating films using a sequence of hand drawn images to create the illusion of movement, such as in early disney works, american cartoons or in Japanese animation",r/learnanimation,"Pencil/Pen, Paper, Editing Software","Solo, Sedentary, Indoor, Cartoons"
Aquarium (Aquascape Art),Maintaing a water tank based environment where the focus is on the aesthetic and appearance of things within the tank,r/Aquascape,"Aquarium Tank, Aqautic Plants","Solo, Sedentary, Indoor, Water"
Aquarium (General),Maintaing a water tank based environment with many sub-disciplines,r/Aquariums,"Aquarium Tank, Aqautic Plants","Solo, Sedentary, Indoor, Water"
Aquarium (Jars/Self-Sustaining),Aquarium (Jars/Self-Sustaining),,,
Aquarium (Plants),Maintaing a water tank based environment where the focus is on cultivating underwater plants,r/PlantedTank,"Aquarium Tank, Aqautic Plants","Solo, Sedentary, Indoor, Water"
Aquarium (Reef),"Maintaing a salt water tank based environment, typically which salt water creatures",r/ReefTank,"Aquarium Tank, Aqautic Plants, Salt Water Reef Fish","Solo, Sedentary, Indoor, Water"
Archaeology ,,r/Archaeology/,,"Solo, Sedentary"
Archery (General),,r/Archery,,"Solo, Active, Competitive"
Archery (Traditional),,r/TraditionalArchery,,"Solo, Active, Competitive"
Architecture,The art and design of creating buildings,r/architecture,"Pencil/Pen, Paper","Solo, Buildings"
Artificial Intelligence/Machine Learning (General),,r/artificial/,,
Asia Central:National Language (Kyrgyz),Primary language of Kyrgyzstan,,,
Asia Central:National Language (Persian),The primary language of Iran(Farsi) and Afghanistan. Also spoken in Tajikistan,r/farsi/,,
Asia Central:National Language (Punjabi),The ninth most natively spoken language in the world. The primary language of Pakistan. Spoken in India,r/punjabi,,
Asia Central:National Language (Tajik),The primary language of Tajikistan,,,
Asia Central:National Language (Turkmen),The primary language of Turkmenistan,,,
Asia Central:National Language (Uzbek),Primary language in Uzbekistan,,,
Asia Central:Native Language (Kazakh),The native language of Kazakhstan (though slightly more speak Russian). Spoken in Kazakhstan,r/kazakh/,,
Asia Eastern:Language (Cantonese),Spoken in Hong Kong and Macau,r/Cantonese/,,
Asia Eastern:National Language (Japanese),The eighth most natively spoken language in the world. The primary language of Japan and Palau.,r/LearnJapanese/,,
Asia Eastern:National Language (Korean),The primary language of North and South Korea.,,,
Asia Eastern:National Language (Mongolian),Primary language in Mongolia (Khalkha dialect is most common),,,
Asia Eastern:Native Language (Hokkien Taiwanese),"A language spoken nearly as much in Taiwan as Mandarin and aggresively pushed over Mandarin, likely due to Taiwan's adversarial relation with China",r/ohtaigi/,,
Asia South Eastern:Language (Javanese),Primary native language of Indonesia. Spoken in Java (though Indonesian and Sudanese are heavily present on the other islands since most islands have their own language).,,,
Asia South Eastern:National Language (Burmese),Spoken in Myanmar (formerly called Burma),r/LearnBurmese/,,
Asia South Eastern:National Language (Filipino Tagalog),A version of Tagalog that is called Filipino occasionally (I think). The primary language of the Philipines (though the philipines have about 187 languages so they have a ton),r/Tagalog,,
Asia South Eastern:National Language (Indonesian),The tenth most spoken language in the world. The primary language of Indonesia.,r/indonesian,,
Asia South Eastern:National Language (Khmer),Primary language of Cambodia. Spoken in Cambodia,,,
Asia South Eastern:National Language (Lao),Primary language of Laos,,,
Asia South Eastern:National Language (Malay),The primary language of Malaysia (which has an insane number of spoken languages and a good amount of English and Hokkien Chinese speakers) and Brunei. Also spoken in Singapore and Indonesia.,r/bahasamelayu,,
Asia South Eastern:National Language (Thai),Primary language spoken in Thailand,,,
Asia South Eastern:National Language (Vietnamese),Primary language in Vietnam (though most speak English),,,
Asia South Eastern:National Lanugage (Creole - Singapore/Singlish),The primary language of Singapore (though many speak Singaporean Mandarin Chinese),,,
Asia South Eastern:National Lanugage (Tetum-Dili),The primary language of East Timor (though Mambai and Makase are spoken heavily and the country has many languages),,,
Asia Southern:Language (Maithili),A language heavily spoken in Nepal in Mithila region,,,
Asia Southern:National Language (Dhivehi),Primary language spoken in the Maldives (though many speak English as well),,,
Asia Southern:National Language (Marathi),The tenth most natively spoken language in the world. Spoken in India.,,,
Asia Southern:National Language (Nepali),Primary langauge of Nepal (though Maithali and many other languages are spoken as well),,,
Asia Southern:National Language (Sinhala),The primary language of Sri Lanka (many also speak Tamil and English),,,
Asia Southern:National Language (Tshangla),The primary language of Bhutan. Spoken mostly in the east.,,,
Asia Southern:Official Language (Dzongkha),The official language of Bhutan. Spoken in Bhutan,,,
Astronomy (Space),,r/Astronomy/,,"Solo, Sedentary"
Augmented Reality/AR,"Interactive experiences where the real world is enhanced by a digital input, commonly as a projection over live video",r/augmentedreality,,"Solo, Sedentary"
Backgammon,,r/backgammon/,,"Group, Sedentary, Indoor"
Backpacking (General),,r/backpacking/,,"Solo, Active, Outdoor"
Backpacking (Ultralight),,r/Ultralight/,,"Solo, Active, Outdoor"
Badminton,,r/badminton/,,"Group, Active, Competitive"
Bake Sales,,,,"Solo, Sedentary"
Baking (Bread),Creating flour based food products from wheat family grains,r/Breadit/,,"Solo, Sedentary, Indoor"
Baking (General),Creating food products using yeast and an oven to allow dough to rise,r/Baking/,,"Solo, Sedentary, Indoor"
Baking (Ginger Bread House),Using baked ginger bread to make works of art,r/GingerbreadHouses/,,"Solo, Sedentary, Indoor"
Bar Hopping ,,r/Bar,,"Solo, Active, Sedentary"
Bartending,,r/bartenders/,,"Group, Active"
Basket Weaving,"Weaving or sewing (typically) natural fibers into baskets, mats, mesh bags or furniture",r/BasketWeaving,,"Sedentary, Solo, Crafts"
Baton Twirling,Using the body to spin a metal rod in a coordinated routine,r/batontwirling,,"Active, Solo"
Beachcombing,,r/beachcombing/,,"Solo, Active, Outdoor"
Beatboxing,A form of vocal percussion which mimmicks drum machines without the use of an external instrument,r/beatbox/,,"Solo, Sedentary"
Beauty Pageants,,,,"Group, Active, Competitive"
Biking (BMX - General),,r/bmx/,,"Solo, Active, Outdoor, Competitive"
Biking (BMX - Trials),,r/biketrials/,,"Solo, Active, Outdoor, Competitive"
Biking (Cycling/Road),,r/cycling/,,"Solo, Active, Outdoor"
Biking (General),,r/Biking/,,"Solo, Active, Outdoor"
Biking (Mountain),,r/mountainbiking/,,"Solo, Active, Outdoor"
Biking (Touring),,r/bicycletouring/,,"Solo, Active, Outdoor"
Billiards (Pool),,r/billiards/,,"Group, Active, Indoor,  Competitive"
Biology (Animals),,r/biology/,,"Solo, Sedentary"
Boat Building,,r/boatbuilding/,,
Boating (General),,r/boating/,,"Solo, Sedentary"
Book Clubs,,r/bookclub,,"Group, Sedentary"
Bookbinding,Physically assembling a book or codex using various methods,r/bookbinding,,"Sedentary, Solo, Crafts"
Botany (Plants),,r/botany/,,"Solo, Sedentary"
Botox,"Botulism toxin injections, which are used to smoothen wrinkles and create a youthly appearance",,,"Solo, Sedentary, Indoor"
Bouldering,,r/bouldering,,"Solo, Active, Indoor"
Bowling,,r/Bowling/,,"Group, Active, Indoor,Competitive"
Boxing,,r/Boxing/,,"Group, Active, Indoor, Competitive"
Building/Assembly (Watchmaking),,r/watchmaking//,,
Bullet journaling,,r/bulletjournal/,,"Solo, Sedentary"
Calligraphy,A visual art involving the aesthetic writing of words and sentences,r/Calligraphy,,"Sedentary, Solo"
Camping,,r/camping/,,"Solo, Active, Outdoor"
Candlemaking,"Imbuing fragrances in and generally creating candles, typically with soy or animal fats",r/candlemaking,,"Sedentary, Solo, Crafts"
Card Tricks (Cardistry),The performance art of card flourishing,r/cardistry,,Solo
Cardmaking,Crafting hand made greeting cards,r/cardmaking,,"Sedentary, Solo, Crafts"
Cartography/Mapmaking,,r/mapmaking/,,
Carving (Ice),Carving sculptures from ice,r/IceSculpting,Ice,Solo
Carving (Wood/Whitling),Carving sculptures from wood,r/Woodcarving,,Solo
CB radio,,r/cbradio/,,"Solo, Sedentary"
Checkers,,r/checkers/,,"Group, Sedentary, Indoor"
Chess,,r/chess/,,"Group, Sedentary, Indoor"
Circus (Aerial),,r/Aerials/,,
Circus (Contortion),"Gymnastic performances associated with Circus, such as trapeze, silks or lyra",,,
Circus (General),,r/circus,,Active
Circus (Trampoline),,r/Trampoline/,,
Citizen Science,,r/CitizenScience/,,
Cleaning (General),,r/CleaningTips/,,"Solo, Active"
Climbing (Rappeling),,r/rappelling/,,"Solo, Group, Active, Outdoor"
Clothesmaking (Corsets),,r/corsets/,,
Clothesmaking (General),Creating clothes and garments,r/DIYclothes,,"Sedentary, Solo, Crafts"
Cloud Watching,,r/CLOUDS/,,"Solo, Sedentary, Outdoor"
Coffee,A bean tea which can be used directly or ground and mixed with milk and syrups and is high in caffeine,r/Coffee/,,"Solo, Sedentary, Indoor"
Collecting (Action Figures),"Posable toys originally targeted for youths, which commonly portray characters from cartoons or comic books",r/ActionFigures,,"Solo, Sedentary"
Collecting (Antiquing/Vintage),,r/Antiques/,,
Collecting (Art),"Any form of art, most commonly paintings and typically expensive",r/artcollecting,,"Solo, Sedentary"
Collecting (Badges),,,,"Solo, Sedentary"
Collecting (Books),Traditional books,r/BookCollecting/,,"Solo, Sedentary"
Collecting (Coins),"Metal currency, often from different countries of origin", r/coincollecting/,,"Solo, Sedentary"
Collecting (Comic Books),"Panel based visual novels, most commonly from the 80s and 90s and commonly portraying superheroes",r/comicbookcollecting,,"Solo, Sedentary"
Collecting (Crystals),Solid materials whose atomic strucure creates a crystal latice. Many crystal enthusiasts believe crystal exposure has various benefits,r/Crystals,,"Solo, Sedentary"
Collecting (D&D Dice),"Crafted dice used to play tabletop roleplaying games, most commonly Dungeons and Dragons",r/DicePorn/,,"Solo, Sedentary"
Collecting (Fossils),,r/FossilHunting/,,
Collecting (Glass Pipes),Glass pipes commonly used for smoking tobacco or marijuana,r/glassheads/,,"Solo, Sedentary"
Collecting (Guns),,,,
Collecting (Knives),Knives crafted via a variety of metalworking techniques and from a plethora of cultures,r/knifeclub,,"Solo, Sedentary"
Collecting (Maps),,r/cartography/,,
Collecting (Marbles),Small balls made of ... well marble,r/Marbles/,,"Solo, Sedentary"
Collecting (Militaria),"Military items like badges, uniforms and antique weaponry",r/Militariacollecting/,,
Collecting (Minerals - General),,r/mineralcollectors/,,
Collecting (Minerals - Radioactive),,r/Radioactive_Rocks/,,
Collecting (Movie Memoribilia),"Props, promotional material and related items relating to films",r/AllMovieMemorabilia/,,"Solo, Sedentary"
Collecting (Periodic Elements),Collecting something from each element in the periodic table,r/elementcollection/,,"Solo, Sedentary"
Collecting (Sneakers),Limited releases sneakers which are often difficult to procure,r/Sneakers/,,"Solo, Sedentary"
Collecting (Sports Cards - Baseball),Cards of professional baseball players,r/baseballcards/,,
Collecting (Stamps/Philately),Postage stamps for and from different countries,r/philately/,,"Solo, Sedentary"
Collecting (Tiki Mugs),Artistic ceramic mugs associated with drinking tiki cocktails,r/Tiki/,,"Solo, Sedentary"
Collecting (Video Game Controllers - Gamecube),,r/customGCC/,,
Collecting (Vinyl Records),Classically formatted discs for playing music which some believe sound better than modern digital music,r/vinyl/,,
Collecting (Watches),,r/Watches/,,
Color Guard,,r/Colorguard/,,"Solo, Active, Competitive"
Competitive Eating,,r/competitiveeating/,,"Group, Competitive"
Composting,,r/composting/,,Solo
Confectionary (Candy),,r/CandyMaking/,,"Solo, Sedentary, Indoor"
Cooking (Cheesemaking),,r/cheesemaking/,,"Solo, Sedentary, Indoor"
Cooking (Dry Aging),A technique of aging meats which develops it's flavor,r/DryAgedBeef/,,
Cooking (General),,r/Cooking/,,"Solo, Sedentary, Indoor"
Cooking (Grilling),"Using a grill to cook and externally char food products, commonly meat and outdoors",r/grilling,,"Solo, Sedentary, Outdoor"
Cooking (Ice Cream),,r/icecreamery/,,"Solo, Sedentary, Indoor"
Cooking (Sous Vide),A cooking technique where food is cooked in a vacuum sealed bag and heated in super hot water where the temperature is easy to specifically control very easily,r/Sous_Vide/,,
Cooking (Vegan),,r/veganrecipes/,,"Solo, Sedentary, Indoor"
Cooking (Vegetarian),,r/VegRecipes/,,"Solo, Sedentary, Indoor"
Cornhole,,r/Cornhole/,,"Group, Sedentary, Outdoor"
Cosplay/Costumes,Creating and wearing clothes typically associated with fictional characters from geek culture such as japanese animation or video games,r/cosplay,,"Sedentary, Solo, Crafts"
Creative Writing (Prompts),Writing essays and novels based on community provided prompts,r/WritingPrompts,,"Sedentary, Solo"
Crocheting,Creating the textile works associated with a crochet hook,r/crochet,,"Crafts, Sedentary, Solo"
Croquet,,r/croquet/,,"Solo, Group, Active, Competitive"
Cryptography (Code Breaking),,r/cryptography/,,"Solo, Sedentary"
Curling,,r/Curling/,,"Solo, Group, Active, Competitive"
Dancing (Ballet),A type of highly technical performance dance which originated in the Renaissance known for being dramatic and graceful,r/BALLET/,,"Active, Solo, Group"
Dancing (Ballroom),A type of classical partner dance which one can compete in,r/ballroom/,,"Active, Group"
Dancing (BBoy/Breakdancing),An athletic type of street dancing known for spinning and floor based moves,r/bboy/,,"Active, Solo, Competitive"
Dancing (Belly),,r/Bellydance/,,
Dancing (Capoiera),,r/capoeira/,,
Dancing (Funk Style),"A collection of street dances including popping, locking, robot, gliding and krumping",r/FunkStyle/,,
Dancing (Line),A choreographed step based dance commonly associated with honky tonks and american country music,r/LineDancing/,,"Active, Group"
