Name,Description,Subreddits,Equipment,Tags
Dancing (Pole),"An acrobatic dance focused around a pole commonly associated with strip clubs, burlesque and erotic dancing",r/poledance/,,"Active, Solo, Erotic"
Dancing (Salsa),A high energy latin partner dance originating in Puerto Rican and Cuban communities,r/Salsa/,,"Active, Group"
Dancing (Shuffling),A type of footwork based dance associated with modern music and EDM,r/shuffle/,,"Active, Solo, Group"
Dancing (Swing),A type of social dance associated with swing jazz or western music,r/SwingDancing/,,"Active, Solo, Group"
Diet (Fasting/Fasted Training),"Fasting in order to control inflammation only to when it is useful for muscle building and to reduce digestional distress, especially from auto-immune disorders or allergies",r/fasting/,,
Diets (Dairy Free),Avoiding foods containing milk products like cheese and milk,r/dairyfree/,,"Solo, Sedentary"
Diets (FODMAP),A short term diet that stops and reintroduces short chain sugar based foods known to cause intestinal distress,r/fodmap/,,"Solo, Sedentary"
Diets (Gluten Free),"Avoiding products containing the wheat protein gluten, most commonly flour based products",r/glutenfree/,,"Solo, Sedentary"
Diets (Intermitent Fasting),,r/intermittentfasting/,,
Diets (Keto),Designed to put a body in a rapid weight loss state called ketosis by completing subbing carbs with fats and keeping protein very high,r/keto/,,"Solo, Sedentary"
Diets (Mediterranean),"Based on the traditional diets of those who live around the mediterranean sea, specifically because there is an idea that it can make you live longer",r/mediterraneandiet/,,
Diets (Paleo),"Eating based on paleolithic human diets, which avoids food that has been processed in most ways",r/Paleo/,,"Solo, Sedentary"
Diets (Pescatarian),A vegeterian diet with the exception of fish,r/Pescatarian/,,
Diets (Vegan),"Avoiding all animal based food products, for health or ethical reasons",r/vegan/,,"Solo, Sedentary"
Diets (Vegetarian),Avoiding animal meat but still eating animal food products such as milk and eggs,r/vegetarian/,,"Solo, Sedentary"
Digital Art (Pixel Art),,r/PixelArt/,,
Diorama,"Creating miniature 3D replicas in high detail, usually of intricate scenes",r/dioramas,,"Crafts, Sedentary, Solo"
Disc Golf,,r/discgolf/,,"Solo, Active, Competitive"
Diving (Free),,r/freediving/,,"Solo, Active, Outdoor"
Diving (General),,r/diving/,,"Solo, Active, Outdoor"
Diving (Scuba),,r/scuba/,,"Solo, Active, Outdoor"
Diving (Snorkel),,r/snorkeling/,,"Solo, Active, Outdoor"
DJing,Mixing and playing recorded electronic music for a live audience,r/DJs/,,"Solo, Sedentary"
Dog Sports,,r/k9sports/,,"Group, Active, Competitive"
Dominoes,,r/dominoes/,,"Group, Sedentary, Indoor"
Drawing (General),"Using a pen or pencil to create pictures on a medium, typically paper but often digitally in modern times",r/drawing,,"Sedentary, Solo"
Drawing (Illustration - Traditional/Digital),,r/Illustration/,,
Driving (ATV/All Terrain Vehicles),,r/ATV/,,
Driving (Camper Vans),,r/CamperVans/,,
Driving (Cars),,r/cars/,,"Solo, Sedentary, Outdoor"
Driving (Dirtbikes),,r/Dirtbikes/,,
Driving (Motorcycles),,r/motorcycles/,,"Solo, Sedentary, Outdoor"
Driving (Planes),,,,"Solo, Sedentary, Outdoor"
Driving (Snowmobile),,r/snowmobiling/,,"Solo, Sedentary, Outdoor"
Drone Video Production (FPV),High speed drones piloted via flying goggles which can perform acrobatic stunts while filming,r/fpv/,,
Drone Video Production (General),Flying remote controlled helicopters to record aerial footage,r/drones,,"Solo, Sedentary, Outdoor, Illegal"
Dungeons and Dragons (General/5th Edition),,r/dndnext/,,"Group, Sedentary, Indoor"
Escape Rooms,,r/escaperooms,,"Solo, Group, Active, Competitive"
Esports,,r/esports/,,"Solo, Group, Active, Competitive"
Europe Central:National Language (Czech),Primary language of The Czech Republic. Spoken in the Czech Republic and Slovakia,r/learnczech/,,
Europe Central:National Language (German),"Primary language of Austria (though most also spek English), Germany (though about half know English), Liechtenstein (though there is a lot of English) and Switzerland (though many speak French and most speak English also). Also spoken in Belgium, Brazil, Luxembourg, Italy and Nambia.",r/German,,
Europe Central:National Language (Hungarian),Primary language of Hungary.,,,
Europe Central:National Language (Polish),Spoken in Poland (though a good number speak English),r/learnpolish/,,
Europe Central:National Language (Slovak),The primary language of Slovakia (though many speak English). Spoken in Slovakia and the Czech Republic,,,
Europe Central:National Language (Slovene),The primary language of Slovenia,,,
Europe Eastern:Language (Moldovan),Spoken in Moldova and Transnistria,,,
Europe Eastern:National Language (Estonian),The primary language of Estonia (though many speak Russian as well). Spoken in Estonia,,,
Europe Eastern:National Language (Latvia),Primay language spoken in Latvia (though many speak Russian as well),,,
Europe Eastern:National Language (Lithuanian),Primary language in Lithuania (though most also speak Russian and a good number English),r/LithuanianLearning/,,
Europe Eastern:National Language (Ukrainian),Primary language in Ukraine (though many speak Russian) and Transnitria,r/ukrainian,,
Europe Northern:National Language (Finnish),The primary language of Finland (thought nearly all also speak English),,,
Europe Northern:National Language (Norwegian),Primary language of Norway (though nearly the same number of english speakers),r/norsk,,
Europe Northern:National Language (Swedish),The primary language of Sweden (though most speak English and were ranked #1 in English proficiency for many years). Also spoken in Finland and Aland.,r/Svenska/,,
Europe South Eastern:Language (Montenegrin),Spoken in Montenegro,,,
Europe South Eastern:National Language (Albanian),The primary language of Albania and Kosovo. Also spoken in Montenegro and North Macedonia,r/Albanian_language/,,
Europe South Eastern:National Language (Armenian),The primary language of Armenia. Spoken in Armenia and the Artsakh region of Azerbaijan,r/hayeren,,
Europe South Eastern:National Language (Bosnian),Primarily spoken in Bosnia (though they have a lot of Serbian). Spoken in Bosnia and Herzegovina. The language is very similar to Serbian and Croatian. ,,,
Europe South Eastern:National Language (Croatian),Primary language of Croatia. Spoken in Croatia and Bosnia-Herzegovinia. The language is very similar to Bosnian and Serbian. ,r/croatian,,
Europe South Eastern:National Language (Macedonian),Primary language of North Macedonia (a good number also speak Albanian),,,
Europe South Eastern:National Language (Romanian),Primary language in Romania (though many speak English) and Moldova (Moldovan),r/romanian/,,
Europe South Eastern:National Language (Serbian),Primary language of Serbia (though a good number know English as well) and Montenegro (though nearly as many speak Montenegrin also). Spoke additionally in Bosnia & Herzegovinia and Kosovo. The language is very similar to Bosnian and Croatian. ,r/Serbian,,
Europe Southern:National Language (Greek),"Primary language of Greece and Cyprus. Spoken in Greece, Cyprus and Albania",r/GREEK/,,
Europe Southern:National Language (Italian),"The primary language of Italy, San Marino and Vatican City. Also spoken also in Croatia, Slovenia and Switzerland.",r/italianlearning,,
Europe Southern:National Language (Maltese),Primary language of Malta,,,
Europe Western:Language (Irish/Irish-Gaelic/Gaelige),The native language of Ireland (though mostly spoken in the Republic of Ireland and almost the entire population speaks English as a first language as well).,r/gaeilge/,,
Europe Western:National Language (Danish),Primary language spoken in Denmark (though almost all speak English and many German). Also spoken in the Faroe Islands,r/danishlanguage,,
Europe Western:National Language (Dutch),"The primary language of the Netherlands (though almost all can speak English there as well) and Belgium. Spoken in Flanders, Brussels, Aruba, Curacao, Sint Maarten and Suriname",r/learndutch,,
Europe Western:National Language (Luxembourgish),Primary language spoken in Luxembourg (though about half also speak English),,,
Event Planning (Parties),,r/partyplanning/,,"Solo, Sedentary"
Event Planning (Wedding - AUS),,,,"Solo, Sedentary"
Event Planning (Wedding - CA),,r/weddingplanningcanada/,,"Solo, Sedentary"
Event Planning (Wedding - General),,r/weddingplanning/,,"Solo, Sedentary"
Exercise (Bodybuilding),Performing high resistance exercises to improve muscle size and shape,r/bodybuilding/,,"Solo, Active"
Exercise (Bodyweight),Bodybuilding without using gym equipment,r/bodyweightfitness,,"Solo, Active"
Exercise (Calisthenics),"Bodyweight exercise commonly employing bars, such as those available at jungle gyms and outdoor fitness areas",r/Calisthenic/,,"Solo, Active"
Exercise (Crossfit),"A cross disciplinary fitness style which tests a multitude of strengths and athleticisms, sometimes competitively",r/crossfit/,,"Solo, Group, Active, Competitive"
Exercise (General Fitness),Exercising to increase physical and cardiovascular strength and endurance,r/Fitness/,,"Solo, Group, Active"
Exercise (Jump-Rope),Jumping over a rope in a coordinated and very fast fashion to practice agility and endurance,r/jumprope/,,"Active, Solo"
Exercise (Kettlebells),,r/kettlebell/,,
Exercise (Knees Over Toes),"Workouts focused on increasing knee strength and flexibility, designed for athletes with knee injuries",r/Kneesovertoes/,,"Solo, Active"
Exercise (Physical Therapy),Workouts generally focused on correcting imbalances to correct posture or strain based pains,,,
Exercise (Pilates),A core focused position based workout similar to yoga which sometimes makes use of a specific exercise machine,r/pilates/,,"Solo, Group, Active"
Exercise (Powerlifting),Focusing on lifting the maximum amount of weight in competition,r/powerlifting/,,"Solo, Active, Competitive"
Fabrics (Cross-Stitching),A form of embroidery which uses a pattern to create a variety of pitcures,r/CrossStitch,,"Crafts, Sedentary, Solo"
Fabrics (Embroidery),Using a needle to decorate a fabric using thread or yarn,r/embroidery,,"Crafts, Sedentary, Solo"
Fabrics (Knitting),Using yarn to create fabric or textile based objects,r/knitting,,"Crafts, Sedentary, Solo"
Fabrics (Lace),Creating delicate fabrics in an open web like pattern,,,"Crafts, Sedentary, Solo"
Fabrics (Macrame),"Creating textile works using knotting techniques, which commonly are hung",r/macrame,,"Crafts, Sedentary, Solo"
Fabrics (Quilting),Sewing at least three fabrics together (which are typically squared) to produce blankets or other textiles works,r/quilting,,"Crafts, Sedentary, Solo"
Fabrics (Rug/Mat Hooking),Creating and decorating rugs or mats using yarn through a stiff material such as burlap,r/rughooking,,"Crafts, Sedentary, Solo"
Fabrics (Sewing - General),Creating or repairing fabric based works by making stitches with a needle and yarn or with a sewing machine,r/sewing,,"Crafts, Sedentary, Solo"
Fabrics (Tapestry),A form of textile art which is woven on a loom to create large images,r/Tapestry,,"Crafts, Sedentary, Solo"
Fantasy Sports (American Football),,r/fantasyfootball/,,"Group, Sedentary, Indoor, Sports"
Fantasy Sports (Basketball),,r/fantasybball/,,"Group, Sedentary, Indoor, Sports"
Farming (Fish/Pisciculture),,r/FishFarming/,,Active
Farming (General),,r/farming/,,"Active, Outdoor"
Fashion,The development of clothing aesthetics that fit certain tastes,r/fashion,,"Crafts, Sedentary, Solo"
Fencing (General),,r/Fencing/,,"Group, Active, Competitive"
Fencing (HEMA/WMA),,r/wma/,,
Filmmaking (Documentaries),,,,
Filmmaking (General),"Creating dramatic works using video, most commonly on a digital medium but rarely with film",r/Filmmakers,,"Sedentary, Solo"
Fishing (Bass),,r/bassfishing/,,"Solo, Sedentary, Active, Outdoor"
Fishing (Deep Sea/Offshore),,r/offshorefishing/,,"Solo, Sedentary, Active, Outdoor"
Fishing (Flats/Inshore),,r/inshorefishing/,,"Solo, Sedentary, Active, Outdoor"
Fishing (Fly),,r/flyfishing/,,"Solo, Sedentary, Active, Outdoor"
Fishing (General),,r/Fishing/,,"Solo, Sedentary, Active, Outdoor"
Fishing (Ice),,r/IceFishing/,,"Solo, Sedentary, Active, Outdoor"
Fishing (Kayaking),,r/kayakfishing/,,"Solo, Sedentary, Active, Outdoor"
Fishing (Noodling),,r/Noodling/,,"Solo, Active, Outdoor"
Fishing (Spear),,,,
Fishing (Trout),,r/troutfishing/,,"Solo, Sedentary, Active, Outdoor"
Flower Arranging,Collecting and orienting flowers in a group to create aesthetically pleasing displays,r/FlowerArranging,,"Sedentary, Solo"
Flower Pressing/Ochibana,Pressing and storing dried wild herbs and flowers into a medium which is typically paper based,r/PressedFlowers,,"Crafts, Sedentary, Solo"
Food Tours,,,,
Foosball,,r/foosball/,,"Group, Active, Competitive"
Foot Golf,,r/footgolf/,,"Solo, Active, Competitive"
Foraging (General),,r/foraging/,,"Solo, Active, Outdoor"
Foraging (Mushrooms),,r/MushroomsandForaging/,,"Solo, Active, Outdoor"
Gardening (Bonsai),,r/Bonsai/,,
Gardening (Fruit Tree/Grafting/Espalier),,r/BackyardOrchard/,,"Solo, Active, Outdoor"
Gardening (General),,r/gardening/,,"Solo, Active, Indoor, Outdoor"
Gardening (Guerilla),,r/GuerrillaGardening/,,"Solo, Active, Outdoor, Illegal"
Gardening (Homesteading),,,,
Gardening (House Plants),,r/houseplants/,,"Solo, Active, Indoor, Outdoor"
Gardening (Hydroponics),,r/Hydroponics/,,"Solo, Active, Indoor, Outdoor"
Gardening (Marijuana),,r/GrowingMarijuana/,,"Solo, Active, Indoor, Outdoor"
Gardening (Mushrooms - Food/Psychoactive),,r/MushroomGrowers/,,
Gardening (Topiary),,r/topiary/,,"Solo, Active, Outdoor"
Genealogy (Family Trees),,r/Genealogy/,,"Solo, Sedentary"
Geocaching (Letterboxing),,r/geocaching/,,"Solo, Active, Outdoor"
Geology (Rocks/Minerals),,,,
Ghost Hunting,,r/GhostHunting/,,"Solo, Active, Outdoor"
Glassblowing (Furnace),Traditional glasswork involving using a super heated furnace that typically yields larger glass vases and works of art,r/glassblowing,,Solo
Glassblowing (Lampwork/Glass Pipes),A form of glasswork that involves using a torch and yields smaller works like glass pipes,r/lampwork,,Solo
Glassblowing (Scientific),Glasswork which focuses on creating superior glassworks which can be used for scentific experimentation,r/scientificglasswork,,Solo
Gliders (Hang-gliding),,r/freeflight/,,"Solo, Active, Outdoor"
Gliders (Paragliding - Acro),,r/freeflight/,,"Group, Sedentary, Indoor"
Gliders (Paragliding - General),,r/freeflight/,,"Solo, Active, Competitive"
Go,,r/gogame/,,"Solo, Illegal"
Golf,,r/golf//,,"Solo, Sedentary"
Graffiti,A type of street spray paint art which is typically displayed illegally in public view,r/Graffiti/,,"Solo, Active, Competitive"
Graphic Design,A visual discipline focusing on the effectiveness of aesthetics in achieving an outcome,r/graphic_design,,"Solo, Sedentary, Illegal"
Gymnastics (General),,r/Gymnastics/,,"Solo, Group, Active, Outdoor"
Hacking,"Bypassing digital security, often illegally",r/hacking,,"Solo, Sedentary"
Hacky Sack (Footbag),,r/footbag/,,"Solo, Sedentary, Indoor"
Hair Care,Using products to improve the quality and appearance of one's hair,r/Haircare/,,"Solo, Sedentary, Indoor"
Hair Removal (Laser),Using a laser to permanently remove hairs from areas of the body,r/LaserHairRemoval/,,"Group, Active, Competitive"
Hair Removal (Waxing),Using wax to achieve very smooth hair removal,r/HairRemoval/,,"Solo, Sedentary"
Handball,,r/Handball/,,"Solo, Active, Outdoor"
Herbal Medicine,Applying and ingesting various herbs for supposed health effects,r/HerbalMedicine/,,"Solo, Active, Outdoor"
Herping/Snake Handling,,r/HerpingPeople/,,"Solo, Active, Outdoor"
Hiking (General),,r/hiking/,,"Solo, Active, Outdoor"
Hiking (Mountaineering/Alpinism),,r/Mountaineering/,,"Solo, Active, Outdoor"
Hiking (Orienteering),,r/orienteering/,,"Solo, Active"
Hiking (Thru),,r/Thruhiking/,,"Active, Solo"
Holiday Decorating,,,,"Solo, Active, Outdoor"
Hooping (Hula),The act of twirling a hoop around your waist without the use of your hands and it's commonly associated dances and activities,r/Hooping,,"Solo, Active, Outdoor"
Horseback/Equestrian (Dressage),,r/Equestrian/,,"Solo, Active, Outdoor"
Horseback/Equestrian (Eventing),,r/Horses/,,"Solo, Active, Outdoor"
Horseback/Equestrian (General),,r/Equestrian/,,"Solo, Sedentary, Active, Outdoor"
Horseback/Equestrian (Show Jumping),,r/showjumping/,,"Solo, Sedentary, Active, Outdoor"
Hunting (Deer),,r/deerhunting/,,Solo
Hunting (General),,r/Hunting/,,"Solo, Active, Competitive"
Ice Bathing/Wim Hof,Submerging yourself in freezing water for extended amounts of time to better control your body,r/BecomingTheIceman/,,"Solo, Active"
Ice Skating (Figure),,r/FigureSkating/,,"Solo, Active, Outdoor"
Ice Skating (General),,r/iceskating/,,"Group, Active, Competitive"
Ice Skating (Nordic),,r/nordicskating/,,"Solo, Sedentary"
Ice Skating (Speed),,r/Speedskating/,,"Solo, Sedentary"
Insect Keeping (Ant/Ant Farms),,r/antkeeping/,,"Solo, Group, Sedentary"
Insect Keeping (Bees),,r/Beekeeping/,,"Solo, Group, Sedentary"
Instruments (Accordion),Bellows and keys in one instrument,r/Accordion/,,"Solo, Group, Sedentary"
Instruments (Bagpipe),A woodwind instrument fed air from a bag commonly associated with Scotland,r/bagpipes,,"Solo, Group, Sedentary"
Instruments (Banjo),A circular stringed instrument commonly associated with American Bluegrass,r/banjo,,
Instruments (Bass),A string instrument which covers a low octave common in all forms of music,r/Bass,,"Solo, Group, Sedentary"
Instruments (Bowed Lyres),,r/BowedLyres/,,"Solo, Group, Sedentary"
Instruments (Clarinet),A woodwind instrument common in marching bands,r/Clarinet,,"Solo, Group, Sedentary"
Instruments (Drums - Kit),"A collection of drums, cymbals and percussive instruments all played in tandem to form the backbone of a song",r/drums r/Drumming,,"Solo, Group, Sedentary"
Instruments (Flute),A reedless woodwind instrument,r/Flute,,
Instruments (Guitar),"A fretted (commonly) six string instrument associated with folk, acoustic, rock and many modern styles of music",r/Guitar,,
Instruments (Guzheng),,r/Guzheng/,,"Solo, Group, Sedentary"
Instruments (Handpan),,r/handpan/,,"Solo, Group, Sedentary"
Instruments (Harmonica),"A handheld free wind instrument associated with blues, folk and country music",r/harmonica,,"Solo, Group, Sedentary"
Instruments (Harp),A large stringed musical instrument commonly associated with calming music,r/harp,,"Solo, Group, Sedentary"
Instruments (Mandolin),A member of the lute family associated with bluegrass music,r/mandolin,,"Solo, Group, Sedentary"
Instruments (Ocarina),"A traditional type of clay or ceramic vessel flute, popularized by the video game The Legend of Zelda: The Ocarina of Time",r/Ocarina,,"Solo, Group, Sedentary"
Instruments (Piano),A stringed keyboard instrument associated with many forms of music historically,r/piano/,,"Solo, Group, Sedentary"
Instruments (Piccolo),A half sized flute played in orchestrated music,r/piccolo/,,"Solo, Group, Sedentary"
Instruments (Recorder),A type of flute with a whistle mouthpiece,r/Recorder,,"Solo, Group, Sedentary"
Instruments (Saxaphone),A brass woodwind instrument heavily associated with Jazz,r/saxophone/,,"Solo, Group, Sedentary"
Instruments (Sitar),An indian plucked string instrument,r/Sitar,,"Solo, Group, Sedentary"
Instruments (Synthesizer),An electronic musical instrument,r/synthesizers,,"Solo, Group, Sedentary"
Instruments (Trumpet),A brass instrument associated with classical and jazz ensembles,r/trumpet,,"Solo, Group, Sedentary"
Instruments (Tuba),A low pitched brass instrument associated with ensembles,r/Tuba,,"Solo, Group, Sedentary"
Instruments (Ukulele),A (commonly) four stringed small fretted instrument associated with hawaiian and island music,r/ukelele,,"Solo, Group, Sedentary"
Instruments (Vibraphone),A percussive instrument commonly associated with jazz and tiki music,r/vibraphone,,"Sedentary, Solo"
Instruments (Violin/Fiddle),A bowed string instrument (which includes violins) played in a variety of worldwide folk musics,r/Fiddle r/violinist,,"Sedentary, Solo"
Interior Decorating (Feng Shui),A type of ancient chinese decorating which is supposed to harmonize an environment with a person,r/FengShui,,
Interior Decorating/Design (General),"The act of decorating an indoor space, typically by furniture selection and placement as well as with various accesories",r/interiordecorating/ ,,"Sedentary, Solo"
Jetsurfing,,r/JetSurfing/,,"Sedentary, Solo"
Jewelry Making,Creating personal accesories with precious metals and often gem stones,r/jewelrymaking/,,"Active, Solo"
Journaling,"Keeping record of daily activities in any medium, though commonly in writing",r/Journaling/,,"Active, Solo"
Juggling (Contact),A style of juggling that focuses on rolling objects throughout the body without tossing them in the air,r/contactjuggling/,,
Juggling (General/Toss),The act of tossing and catching multiple objects into the air in sequence without dropping them,r/juggling,,"Solo, Sedentary, Indoor, Illegal"
Juggling (Kendama),,,,"Solo, Active"
Kava,,r/Kava/,,"Solo, Active"
Kite Boarding (General),,r/Kiteboarding/,,"Solo, Sedentary, Outdoor"
Kite Boarding (Kitefoil),,r/Kiteboarding/,,"Crafts, Sedentary, Solo"
Kite Flying,,r/kites/,,"Solo, Sedentary, Indoor"
Knot Tying,"Tangling rope as art or to create certain functionalities in use, commonly associated with sailing and fishing",r/knots,,"Solo, Active, Outdoor"
Kombucha,,r/Kombucha/,,
Landscaping,,r/landscaping/,,
Language (Scots/Lowland or Broadland Scots),Spoken in Scotland,r/scots/,,
Language (Susu),Spoken heavily in Guinea. Spoken in Guinea and Sierra Leone as part of the Mande language group,,,
Language (Temne),A language spoken heavily in northern Sierra Leone,,,"Group, Active, Outdoor"
Language (Welsh),Spoken in Whales in the UK,r/learnwelsh/,,"Group, Active, Indoor"
LARPing (Live Action Role Playing),,r/LARP/,,
Laser Tag,,r/lasertag/,,"Crafts, Sedentary, Solo"
Law (General),, r/legaladvice/,,
Leathercraft (General),Shaping and coloring leather to create works of art,r/Leathercraft/,,"Solo, Sedentary"
Leathercraft (Whipmaking),,r/whipmaking/,,"Solo, Sedentary"
Linguistics (Language),,r/linguistics/,,
Lip reading,,,,
Live Performance (Bands),,,,
Live Performance (Circus),,,,
Live Performance (Orchestra),,,,Solo
Live Performance (Plays),,,,"Solo, Sedentary"
Live Performance (Sports),,,,
Livestreaming,"Broadcasting and recording video in tandem over the internet, commonly associated with Twitch and video game streaming",r/streaming,,
Longboarding (Dancing),,r/longboarding/,,
Magnet Fishing,,r/magnetfishing/,,"Solo, Sedentary, Active, Outdoor"
Mahjong (General),,r/Mahjong/,,"Group, Sedentary, Indoor"
Mahjong (Riichi),,r/riichi/,,"Group, Sedentary, Indoor"
Makeup (General),"Using cosmetics to achieve certain aesthetics, most commonly on the face",r/Makeup/,,"Sedentary, Solo"
Manufacturing (Machining),"Creating metal components and tooling by subtracting material from metal slabs, typically with heavy machinery",r/machining,,Solo
Marine Biology (Ocean Creatures),,,,
Martial Arts (Aikido),,r/aikido/,,
Martial Arts (Brazilian Jiu Jitsu/BJJ),,r/bjj/,,"Group, Active, Competitive"
Martial Arts (Judo),,r/judo/,,"Group, Active, Competitive"
Martial Arts (Karate),,r/karate/,,"Group, Active, Competitive"
Martial Arts (Kickboxing),,r/Kickboxing/,,"Group, Active, Competitive"
Martial Arts (Krav Maga),,r/kravmaga/,,"Group, Active, Competitive"
Martial Arts (Kung Fu),,r/kungfu/,,"Group, Active, Competitive"
Martial arts (MMA),,r/MMA/,,"Group, Active, Competitive"
Martial Arts (Muay Thai),,r/MuayThai/,,"Group, Active, Competitive"
Martial Arts (Taekwondo),,r/taekwondo/,,"Group, Active, Competitive"
Massage (Acupuncture),A chinese massage pratice involving placing subtle needles in the skin to relieve pain and stress,,,
Massage (General),Pushing and pulling tactically on muscles to reduce pain and increase performance,r/massage/,,"Group, Sedentary, Active"
Matchmaking,,,,"Group, Sedentary"
Mechanic,,r/MechanicAdvice/ r/autorepair/,,"Solo, Active"
Mechanical Keyboards,Buildling and customizing mechanical keyboards,r/mechanicalkeyboards,,
Meditation (General),A variety of sedentary practices which silence and focus the mind,r/Meditation/,,"Solo, Sedentary"
Metal Detecting,,r/metaldetecting/,,"Solo, Sedentary, Active, Outdoor"
Meteorology (Weather),,r/meteorology/,,"Solo, Sedentary"
Microbiology (Micro Organisms),,r/microbiology/,,"Solo, Sedentary"
Middle East:National Language (Azerbaijani),The primary language of Azerbaijan. Spoken in Azerbaijan,,,
Middle East:National Language (Georgian),"Primary language of Georgia. Spoken in Georgia, South Ossetia and Abkhazia",,,
Middle East:National Language (Turkish),"The primary language of Turkey, Cyprus and the Turkish Repiblic of Northern Cyrpus",,,
Military Care Package (Sandboxing),,r/SandBoxxit/,,"Solo, Sedentary"
Miscellaneous Sports,,r/theocho/,,
Model Building (Cars),Assembling and decorating miniature replicas of cars,r/ModelCars/,,"Crafts, Sedentary, Solo"
Model Building (Gundam/Gunpla),"Assembling and decorating miniature replicas of robots from the anime, Gundam",r/Gunpla/,,"Crafts, Sedentary, Solo"
Model Building (Lego),"Creating works of art using the classic plastic construction toy, Lego",r/lego,,"Crafts, Sedentary, Solo"
Model Building (Train/Railways),"Assembling and decorating miniature replicas of trains and railways, usually with an electronic component to run them",r/modeltrains,,"Crafts, Sedentary, Solo"
Modeling,The act of being videod or photographed for aesthetic purposes,r/MODELING,,"Active, Solo, Group"
Monopoly,,r/monopoly/,,"Group, Sedentary, Indoor"
Motivating,,,,"Solo, Sedentary"
Nail Art,"The decorating, enhancement and embelishment of nails",r/RedditLaqueristas,,"Crafts, Sedentary, Solo"
National Language (Bulgarian),The primary language of Bulgaria.,,,
